{
  "schema_version": "1.0.0",
  "artifact_type": "00_context",
  "investigation_id": "RQ-0007-v001",
  "rq_id": "RQ-0007",
  "context_state": "draft",
  "question": {
    "text": "What conditions produce the observed effect?",
    "notion_url": null
  },
  "question_type": null,
  "scope": null,
  "significance": null,
  "frozen_at": null
}
